{
  "type": "qsol-int-adapter-envelope",
  "protocol": "QSOL-INT/ADAPTER/1",
  "version": "1.0.0",
  "id": "INT-ADAPT-FIX-007",
  "messages": [
    {
      "role": "user",
      "content": "Preserve the live drift warning."
    }
  ],
  "annotations": {
    "epistemic_state": "known",
    "claim_maturity": "ESTABLISHED",
    "scenario": "ACTUAL",
    "register": "LITERAL",
    "provenance": [
      {
        "source_id": "fixture.source.valid",
        "locator": "urn:qsol:int:adapter:valid"
      }
    ],
    "mode": {
      "primary": "engineering",
      "secondary": [],
      "bridges": [],
      "material_cross_domain": false
    },
    "drift": {
      "status": "AUTHORITY_DRIFT",
      "review_required": true
    }
  }
}
